{
  "id": "brief-event-recon",
  "title": "Event-Driven Payment Reconciliation Engine with Double-Entry Ledger",
  "domain": "FinTech Engineering",
  "difficulty": "ADVANCED",
  "project_types": [
    "Distributed systems",
    "Data pipeline/ETL"
  ],
  "problem": "Financial platforms process millions of money movements across payment gateways, banking settlement rails, and merchant accounts. Webhook packet loss, bank batch file settlement delays, currency rounding, and timezone drift cause constant transaction discrepancies. Manual reconciliation is slow and prone to errors. This project builds an automated, event-driven payment reconciliation engine in Python and FastAPI. The system processes payment gateway webhook streams from Kafka, parses daily bank settlement CSV files, enforces double-entry ledger accounting invariants in PostgreSQL, executes three-way match algorithms across transactions, classifies breaks into distinct categories (unmatched settlement, fee drift, timing discrepancy), and generates audit-ready financial break reports.",
  "use_cases": [
    "FinTech payment processor daily settlement reconciliation against banking partner clearing files",
    "E-commerce merchant multi-gateway audit verifying Stripe, Adyen, and PayPal payout accuracy",
    "Lending platform loan disbursement and repayment tracking with automated discrepancy detection"
  ],
  "hard_parts": [
    "Enforcing immutable double-entry ledger accounting invariants (Assets = Liabilities + Equity) across high concurrency",
    "Resolving three-way matching between asynchronous gateway webhooks, internal ledger entries, and delayed bank clearing files",
    "Classifying financial discrepancies into actionable break buckets (unmatched settlement, fee mismatch, timing drift)",
    "Ensuring idempotent event ingestion so replayed Kafka webhooks never create duplicate ledger journal postings"
  ],
  "screener_signals": [
    "Clean Python implementation separating double-entry ledger, Kafka consumers, reconciliation matchers, and break reporters",
    "Automated reconciliation test suite with 25 intentionally seeded financial break scenarios verifying 100% detection",
    "Anti-fake verification script injecting a dynamic unrecorded settlement row and asserting exact discrepancy flag generation"
  ],
  "job_families": [
    "FinTech Software Engineer",
    "Core Ledger Backend Engineer",
    "Financial Data Engineer"
  ],
  "stack": [
    {
      "tool": "Python",
      "role": "primary programming language for ledger logic, settlement parsing, and reconciliation"
    },
    {
      "tool": "Kafka",
      "role": "event streaming platform delivering gateway payment event webhooks"
    },
    {
      "tool": "PostgreSQL",
      "role": "relational database storing immutable double-entry ledger journals and transactions"
    },
    {
      "tool": "FastAPI",
      "role": "web framework serving reconciliation status APIs and audit report endpoints"
    }
  ],
  "architecture": {
    "components": [
      {
        "name": "Double-Entry General Ledger Core",
        "tools_used": [
          "Python",
          "PostgreSQL"
        ],
        "purpose": "Enforces immutable debit/credit journal entries and guarantees ledger balance invariant integrity"
      },
      {
        "name": "Kafka Webhook Ingestion Consumer",
        "tools_used": [
          "Python",
          "Kafka"
        ],
        "purpose": "Consumes gateway payment webhooks idempotently, preventing duplicate transaction recordings"
      },
      {
        "name": "Bank Settlement File Parser",
        "tools_used": [
          "Python"
        ],
        "purpose": "Parses structured daily bank clearing CSV/BAI2 settlement records and normalizes payout line items"
      },
      {
        "name": "Three-Way Reconciliation Matcher",
        "tools_used": [
          "Python",
          "PostgreSQL"
        ],
        "purpose": "Executes rule-based matching across gateway events, internal orders, and bank settlement deposits"
      },
      {
        "name": "Financial Break Classifier & Reporter",
        "tools_used": [
          "Python",
          "FastAPI"
        ],
        "purpose": "Categorizes unmatched records into fee, timing, and missing break buckets, exposing audit endpoints"
      }
    ],
    "data_flow": "Payment gateway webhooks arrive via Kafka; the Ingestion Consumer validates idempotency and posts balanced debit/credit entries to the Double-Entry General Ledger; daily bank settlement CSV files are ingested by the Settlement Parser; the Three-Way Reconciliation Matcher links internal order IDs, gateway transaction references, and bank settlement lines; matching records are marked RECONCILED; mismatched records are categorized by the Break Classifier into fee variances, timing delays, or missing settlements; audit reports and summary metrics are exposed via FastAPI.",
    "enforcement_mechanism": "PostgreSQL database check constraints guaranteeing zero debit/credit imbalance per journal transaction; idempotent event keys preventing double posting."
  },
  "targets": [
    {
      "metric": "Seeded Financial Break Detection Rate",
      "method": "Reconciliation engine execution against historical financial batch with 25 seeded monetary discrepancies",
      "input": "Batch of 50,000 transactions containing 25 seeded breaks (10 fee drifts, 10 missing settlements, 5 duplicate webhooks)",
      "environment": "Standard 4-core local CPU, Python 3.11, PostgreSQL 15+",
      "minimum_pass": "Detection of 25 of 25 seeded breaks with 0 false negatives",
      "target": "Detection of 25 of 25 seeded breaks with 0 false negatives",
      "report": "Financial reconciliation audit log detailing detected break categories and transaction references"
    },
    {
      "metric": "Batch Reconciliation Execution Throughput",
      "method": "Processing throughput to ingest, normalize, and reconcile three-way financial transactions",
      "input": "100,000 transactions evaluated against 100,000 bank settlement records",
      "environment": "Standard 4-core local CPU, Python 3.11, PostgreSQL 15+",
      "minimum_pass": "Throughput exceeds 5,000 transactions/sec",
      "target": "Throughput exceeds 12,000 transactions/sec",
      "report": "Reconciliation benchmark performance report"
    },
    {
      "metric": "Double-Entry Ledger Balance Invariant Violation Rate",
      "method": "Integrity validation verifying total debits equal total credits across all posted journal entries",
      "input": "100,000 posted financial journal entries evaluated after heavy concurrent execution",
      "environment": "Standard 4-core local CPU, PostgreSQL 15+",
      "minimum_pass": "0 ledger balance invariant violations across journal transactions",
      "target": "0 ledger balance invariant violations across journal transactions",
      "report": "Trial balance accounting verification report confirming zero variance"
    }
  ],
  "skills": [
    "Python",
    "Kafka",
    "PostgreSQL",
    "FastAPI",
    "FinTech",
    "Distributed Systems",
    "Data Pipelines"
  ],
  "starter_input": {
    "spec": "Sample gateway webhook event schema, bank clearing settlement CSV specification, and double-entry ledger chart of accounts.",
    "size": "50,000 synthetic transaction records, 48,000 bank settlement lines, and 25 intentionally seeded discrepancies",
    "seeded_cases": "Uncaptured gateway authorisations, foreign exchange fee variances, missing bank settlement lines, and replay webhooks",
    "label_source": "Deterministic reconciliation ground truth manifest mapping transaction IDs to expected break classifications",
    "personal_data_policy": "Strictly mock synthetic financial records and simulated account numbers; zero real banking or cardholder data used"
  },
  "components": [
    {
      "name": "Double-Entry General Ledger Core & Invariant Validator",
      "task_type": "low-level/system subsystem",
      "hours": 6.0
    },
    {
      "name": "Kafka Gateway Webhook Ingestion & Idempotent Consumer",
      "task_type": "data pipeline step",
      "hours": 5.0
    },
    {
      "name": "Bank Settlement Batch Parser & Normalizer",
      "task_type": "data pipeline step",
      "hours": 5.0
    },
    {
      "name": "Three-Way Reconciliation Matching Engine",
      "task_type": "data pipeline step",
      "hours": 6.0
    },
    {
      "name": "Break Classifier & Financial Exception Manager",
      "task_type": "API endpoint group with tests",
      "hours": 5.0
    },
    {
      "name": "Discrepancy Injection Test Harness & Audit Benchmark",
      "task_type": "load or performance test harness + report",
      "hours": 4.0
    },
    {
      "name": "Ledger State Flow Diagram & Accounting Runbook",
      "task_type": "docs + architecture diagram",
      "hours": 3.0
    }
  ],
  "extended_path": {
    "items": [
      "Automated dispute resolution and chargeback adjustment workflow with refund ledger reversal",
      "High-throughput parallel reconciliation worker using DuckDB for multi-million row settlement files"
    ],
    "hours": 16
  },
  "milestones": [
    {
      "name": "Double-Entry Ledger Engine & Invariant Enforcement in Python FinTech",
      "hours": 10,
      "done_criterion": "General ledger stores balanced entries; database constraints reject any unbalanced transaction."
    },
    {
      "name": "Kafka Payment Webhook Consumer & Bank Settlement File Parser in Data Pipelines",
      "hours": 10,
      "done_criterion": "Consumer ingests webhooks idempotently; parser normalizes daily bank CSV settlement records."
    },
    {
      "name": "Three-Way Reconciliation Algorithm & Discrepancy Break Classifier in Distributed Systems",
      "hours": 10,
      "done_criterion": "Matching engine executes 3-way match, classifying unmatched rows into fee, timing, and missing breaks."
    },
    {